[{
		"název": {
			"cs": "Smrk u obrázku na Miroslavi"
		},
		"poznámka": {
			"cs": "cca 1 km jižně od kostela v Lipové Lázních, u lesní cesty cca 200 m nad rekreačním areálem Miroslav"
		},
		"druh_dřeviny": {
			"cs": "Smrk ztepilý"
		},
		"obrázek": ["https://d34-a.sdn.szn.cz/d_34/c_img_G_K/qraBzdw.jpeg"],
		"typ_dřeviny": "https://data.mvcr.gov.cz/zdroj/číselníky/typy-dřevin/položky/jehličnatý-strom",
		"kategorie_ochrany": "https://data.mvcr.gov.cz/zdroj/číselníky/kategorie-územní-ochrany/položky/přírodní-památka",
		"umístění": {
			"geometrie": {
				"type": "Point",
				"coordinates": [50.22054209714138, 17.128712012726094]
			},
			"adresa": {
				"název_kraje": {
					"cs": "Olomoucký"
				},
				"název_okresu": {
					"cs": "Jeseník"
				},
				"název_obce": {
					"cs": "Jeseník"
				}
			}
		}
	},
	{
		"název": {
			"cs": "Kaštany u kostela"
		},
		"poznámka": {
			"cs": "Před kostelem Nanebevzetí Panny Marie asi 50 m od náměstí Svobody ve Zlatých Horách"
		},
		"obrázek": ["https://d34-a.sdn.szn.cz/d_34/c_img_G_U/eo8BXFN.jpeg"],
		"typ_dřeviny": "https://data.mvcr.gov.cz/zdroj/číselníky/typy-dřevin/položky/listnatý-strom",
		"kategorie_ochrany": "https://data.mvcr.gov.cz/zdroj/číselníky/kategorie-územní-ochrany/položky/přírodní-památka",
		"umístění": {
			"geometrie": {
				"type": "LineString",
				"coordinates": [
					[50.26519422535036, 17.398559716715265],
					[50.265107459617475, 17.398591795934845],
					[50.26498719685399, 17.39860601169148]
				]
			},
			"adresa": {
				"název_kraje": {
					"cs": "Olomoucký"
				},
				"název_okresu": {
					"cs": "Jeseník"
				},
				"název_obce": {
					"cs": "Jeseník"
				}
			}
		}
	}
]